{"claims":[{"amount":28.6,"attempt":1,"baseline":17.8,"claim_id":"clm_m_022_preview_NTG_VES_a1","claim_type":"matchup","confidence":"low","context_check":"ok","evidence":["m_004_e00083","m_004_e00147","m_004_e00506","m_004_e00529","m_002_e00113","m_002_e00208","m_002_e00357","m_002_e00543","m_001_e00103","m_001_e00501","m_001_e00565","m_001_e00672"],"fact_check":"pass","interval":{"high":31.9,"level":0.95,"low":25.4},"metric":"zone_mismatch","rule_ids":[],"sample_size":732,"scope":"season","status":"published","subject":["team","t_ntg"],"unit":"percent"},{"amount":28.7,"attempt":1,"baseline":21.0,"claim_id":"clm_m_022_preview_VES_NTG_a1","claim_type":"matchup","confidence":"high","context_check":"ok","evidence":["m_004_e00004","m_004_e00026","m_004_e00140","m_004_e00290","m_001_e00333","m_001_e00348","m_001_e00400","m_001_e00445","m_002_e00407","m_002_e00439","m_002_e00736","m_002_e00814"],"fact_check":"pass","interval":{"high":31.8,"level":0.95,"low":25.8},"metric":"zone_mismatch","rule_ids":[],"sample_size":865,"scope":"season","status":"published","subject":["team","t_ves"],"unit":"percent"},{"amount":46.3,"attempt":1,"claim_id":"clm_m_022_momentum_t_ntg_1860_2460_a1","claim_type":"stat","context_check":"ok","evidence":[517,519,521,522,524,526,533,534,536,537,539,540,541,543,546],"fact_check":"pass","metric":"momentum","rule_ids":[],"sample_size":103,"scope":"window","status":"published","subject":["team","t_ntg"],"unit":"score_0_100"},{"amount":0.75,"attempt":1,"claim_id":"clm_m_022_xg_t_ves_0_2965_a1","claim_type":"stat","context_check":"misleading","evidence":[79,162,248,297,869],"fact_check":"pass","metric":"xg","rule_ids":["small_sample_xg"],"sample_size":5,"scope":"window","status":"blocked","subject":["team","t_ves"],"unit":"xg"},{"amount":0.75,"attempt":2,"claim_id":"clm_m_022_xg_t_ves_0_2965_a2","claim_type":"stat","context_check":"misleading","evidence":[79,162,248,297,869],"fact_check":"pass","metric":"xg","revision_of":"clm_m_022_xg_t_ves_0_2965_a1","rule_ids":["small_sample_xg"],"sample_size":5,"scope":"window","status":"published_with_context","subject":["team","t_ves"],"unit":"xg"},{"amount":1,"attempt":1,"claim_id":"clm_m_022_pat_flank_isolation_t_ves_0_2965_a1","claim_type":"pattern","context_check":"ok","evidence":[815,826],"fact_check":"pass","metric":"pat_flank_isolation","rule_ids":[],"sample_size":2,"scope":"window","status":"published","subject":["team","t_ves"],"unit":"count"},{"amount":1.13,"attempt":1,"claim_id":"clm_m_022_rhythm_index_t_ntg_2700_3600_a1","claim_type":"stat","context_check":"ok","evidence":[802,829,836,843,859,876,881,898,903,944,966,1007,1023,1029,1085],"fact_check":"pass","metric":"rhythm_index","rule_ids":[],"sample_size":18,"scope":"window","status":"published","subject":["team","t_ntg"],"unit":"per_min"},{"amount":0.119,"attempt":1,"claim_id":"clm_m_022_xt_added_VES_11_0_4125_a1","claim_type":"stat","context_check":"ok","evidence":[1285],"fact_check":"pass","metric":"xt_added","rule_ids":[],"sample_size":1,"scope":"window","status":"published","subject":["player","VES_11"],"unit":"xt"},{"amount":69.7,"attempt":1,"claim_id":"clm_m_022_field_tilt_t_ves_2700_4500_a1","claim_type":"stat","context_check":"misleading","evidence":[868,893,916,917,918,950,951,953,1026,1285,1356,1384,817,818,819],"fact_check":"pass","metric":"field_tilt","rule_ids":["ctx_dominance_with_transition_exposure"],"sample_size":46,"scope":"window","status":"blocked","subject":["team","t_ves"],"unit":"percent"},{"amount":69.7,"attempt":2,"claim_id":"clm_m_022_field_tilt_t_ves_2700_4500_a2","claim_type":"stat","context_check":"misleading","evidence":[868,893,916,917,918,950,951,953,1026,1285,1356,1384,817,818,819],"fact_check":"pass","metric":"field_tilt","revision_of":"clm_m_022_field_tilt_t_ves_2700_4500_a1","rule_ids":["ctx_dominance_with_transition_exposure"],"sample_size":46,"scope":"window","status":"published_with_context","subject":["team","t_ves"],"unit":"percent"},{"amount":50,"attempt":1,"claim_id":"clm_m_022_milestone_count_NTG_20_0_4798_a1","claim_type":"milestone","context_check":"ok","evidence":[215,244,322,333,401,426,487,501,506,524,547,583,588,598,604],"fact_check":"pass","metric":"milestone_count","rule_ids":[],"sample_size":50,"scope":"window","status":"published","subject":["player","NTG_20"],"unit":"count"},{"amount":0.47,"attempt":1,"claim_id":"clm_m_022_rhythm_index_t_ntg_4500_5400_a1","claim_type":"stat","context_check":"ok","evidence":[1413,1425,1428,1455,1459,1479,1487,1518,1532,1564,1571,1598,1614,1626,1666],"fact_check":"pass","metric":"rhythm_index","rule_ids":[],"sample_size":15,"scope":"window","status":"published","subject":["team","t_ntg"],"unit":"per_min"},{"amount":50,"attempt":1,"claim_id":"clm_m_022_milestone_count_VES_06_0_5428_a1","claim_type":"milestone","context_check":"ok","evidence":[40,53,98,148,155,160,184,194,201,452,457,462,533,541,569],"fact_check":"pass","metric":"milestone_count","rule_ids":[],"sample_size":50,"scope":"window","status":"published","subject":["player","VES_06"],"unit":"count"},{"amount":0.045,"attempt":1,"claim_id":"clm_m_022_xt_added_VES_10_0_5512_a1","claim_type":"stat","context_check":"ok","evidence":[1723],"fact_check":"pass","metric":"xt_added","rule_ids":[],"sample_size":1,"scope":"window","status":"published","subject":["player","VES_10"],"unit":"xt"},{"amount":0.65,"attempt":1,"claim_id":"clm_m_022_xg_t_ntg_0_6036_a1","claim_type":"stat","context_check":"misleading","evidence":[17,275,350,417,427,448,508,601,640,723,757,856,1156,1333,1336],"fact_check":"pass","metric":"xg","rule_ids":["shot_spam"],"sample_size":18,"scope":"window","status":"blocked","subject":["team","t_ntg"],"unit":"xg"},{"amount":0.65,"attempt":2,"claim_id":"clm_m_022_xg_t_ntg_0_6036_a2","claim_type":"stat","context_check":"misleading","evidence":[17,275,350,417,427,448,508,601,640,723,757,856,1156,1333,1336],"fact_check":"pass","metric":"xg","revision_of":"clm_m_022_xg_t_ntg_0_6036_a1","rule_ids":["shot_spam"],"sample_size":18,"scope":"window","status":"published_with_context","subject":["team","t_ntg"],"unit":"xg"},{"amount":17.67,"attempt":1,"claim_id":"clm_m_022_ppda_t_ntg_0_6036_a1","claim_type":"stat","context_check":"misleading","evidence":[68,100,196,644,753,760,978,1107,1597,1632,1651,1679],"fact_check":"pass","metric":"ppda","rule_ids":["ppda_alone"],"sample_size":12,"scope":"window","status":"blocked","subject":["team","t_ntg"],"unit":"ratio"},{"amount":17.67,"attempt":2,"claim_id":"clm_m_022_ppda_t_ntg_0_6036_a2","claim_type":"stat","context_check":"ok","evidence":[68,100,196,644,753,760,978,1107,1597,1632,1651,1679],"fact_check":"pass","metric":"ppda","revision_of":"clm_m_022_ppda_t_ntg_0_6036_a1","rule_ids":[],"sample_size":12,"scope":"window","status":"published","subject":["team","t_ntg"],"unit":"ratio"},{"amount":5,"attempt":1,"claim_id":"clm_m_022_chances_created_NTG_07_0_6036_a1","claim_type":"stat","context_check":"ok","evidence":[273,348,755,855,1619],"fact_check":"pass","metric":"chances_created","rule_ids":[],"sample_size":5,"scope":"window","status":"published","subject":["player","NTG_07"],"unit":"count"},{"amount":22,"attempt":1,"claim_id":"clm_m_022_forward_passes_NTG_07_0_6036_a1","claim_type":"stat","context_check":"misleading","evidence":[12,34,83,117,175,273,329,341,581,748,1216,1313,1474,1508,1511],"fact_check":"pass","metric":"forward_passes","rule_ids":["wide_forward_passes"],"sample_size":22,"scope":"window","status":"blocked","subject":["player","NTG_07"],"unit":"count"},{"amount":22,"attempt":2,"claim_id":"clm_m_022_forward_passes_NTG_07_0_6036_a2","claim_type":"stat","context_check":"misleading","evidence":[12,34,83,117,175,273,329,341,581,748,1216,1313,1474,1508,1511],"fact_check":"pass","metric":"forward_passes","revision_of":"clm_m_022_forward_passes_NTG_07_0_6036_a1","rule_ids":["wide_forward_passes"],"sample_size":22,"scope":"window","status":"published_with_context","subject":["player","NTG_07"],"unit":"count"},{"amount":26,"attempt":1,"claim_id":"clm_m_022_forward_passes_VES_06_0_6036_a1","claim_type":"stat","context_check":"ok","evidence":[40,148,155,201,533,541,613,674,740,793,863,904,914,945,981],"fact_check":"pass","metric":"forward_passes","rule_ids":[],"sample_size":26,"scope":"window","status":"published","subject":["player","VES_06"],"unit":"count"},{"amount":17,"attempt":1,"claim_id":"clm_m_022_crosses_t_ves_0_6036_a1","claim_type":"stat","context_check":"misleading","evidence":[78,160,471,621,666,879,1005,1026,1195,1231,1285,1386,1419,1661,1691],"fact_check":"pass","metric":"crosses","rule_ids":["ctx_crosses_vs_cutbacks"],"sample_size":17,"scope":"window","status":"blocked","subject":["team","t_ves"],"unit":"count"},{"amount":17,"attempt":2,"claim_id":"clm_m_022_crosses_t_ves_0_6036_a2","claim_type":"stat","context_check":"misleading","evidence":[78,160,471,621,666,879,1005,1026,1195,1231,1285,1386,1419,1661,1691],"fact_check":"pass","metric":"crosses","revision_of":"clm_m_022_crosses_t_ves_0_6036_a1","rule_ids":["ctx_crosses_vs_cutbacks"],"sample_size":17,"scope":"window","status":"published_with_context","subject":["team","t_ves"],"unit":"count"}],"duration_sec":6036,"events":{"cols":["event_id","clock_sec","team","player_id","event_type","outcome","related_player_id"],"omitted_types":["pressure","possession_change","carry","duel","pass"],"outcomes":["blocked","end","fail","fatigue","free_kick","goal","held","injury","off","off_target","offside","parried","saved","success","tactical","yellow"],"rows":[[12,42,"NTG","NTG_07",11,13,null],[17,57,"NTG","NTG_07",14,0,null],[18,57,"VES","VES_04",1,13,null],[22,88,"VES","VES_31",4,13,null],[23,92,"VES","VES_02",0,13,null],[26,99,"VES","VES_10",5,2,null],[27,99,"NTG","NTG_03",16,13,null],[29,99,"VES","VES_10",6,4,"NTG_03"],[34,134,"NTG","NTG_07",11,13,null],[37,139,"VES","VES_11",1,13,null],[38,140,"VES","VES_06",0,13,null],[40,145,"VES","VES_06",11,13,null],[53,170,"VES","VES_06",11,13,null],[61,198,"VES","VES_03",4,13,null],[62,203,"NTG","NTG_07",0,13,